{
  "schema_version": 1,
  "id": "00000000-0000-0000-0000-000000000001",
  "name": "Riverside 2-Bed Apartment",
  "owner_id": "00000000-0000-0000-0000-0000000000aa",
  "units": "m",
  "jurisdiction_id": "generic-ibc-2021",
  "boundary_id": "00000000-0000-0000-0000-000000000010",
  "program_id": "00000000-0000-0000-0000-000000000020",
  "current_plan_id": "00000000-0000-0000-0000-000000000030",
  "created_at": "2026-06-01T09:00:00Z",
  "updated_at": "2026-06-04T22:13:00Z"
}
